,ID,timestamp,checkpoint,mistakes,preparation,office_hours,semester
162,18832,2021-05-07 11:26:00,10,"I used a quotient and product rule, because I neglected to consider the chain rule as an option.","I will again go back into the reading and look at when I should use a chain rule and when I should use a product rule. I clearly didn't understand it well enough before, but I'll be sure to this time around.",No,Sp21 - 001
163,77508,2021-04-11 13:40:00,10,I would have to look back at the questions to see what I messed up on,I will re-read the chapters that correlate with these checkpoints and try sample problems,Yes,Sp21 - 001
164,88009,2021-03-25 17:11:00,10,I conducted cancellation in the numerator when it is not needed.,I will clear up my mistake by watching a video example.,No,Sp21 - 001
165,38687,2021-03-26 08:45:00,10,I didn't use the quotient rule.,I will practice and use the quotient rule.,No,Sp21 - 001
166,38687,2021-03-26 08:45:00,10,I didn't use the quotient rule.,I will practice and use the quotient rule.,No,Sp21 - 001
167,18832,2021-04-27 20:12:00,11,My main misunderstanding in this checkpoint was using the -1 as an exponent rather as a sign that it was actually meant to be 1/sin. That simple mistake made the math wrong for that particular checkpoint.,I'm going to look over the sign definitions before I redo this checkpoint.,No,Sp21 - 001
168,62783,2021-05-04 20:11:00,11,"I think that I just didn't read the notes on these formulas well enough, and when I attempted the checkpoint I was just going off what I had learned previously","I've already gone back over the notes in the text, and I plan to watch review videos to increase my understanding of where I went wrong before",No,Sp21 - 001
169,18832,2021-05-07 11:27:00,11,"I mistook the inverse of tan for 1/tan, so I did something completely different than what I had to do.",I'm going to go back and memorize the derivative of the inverse of tan. I didn't have it memorized before.,No,Sp21 - 001
170,44661,2021-04-14 10:56:00,11,"(3) I should have remembered that because I was using the limit definition that I needed to write the limit when I analyzed the problem.
 (4) I mixed the idea that temperature is equal to the function of f(q) which means that Temperature will change because it is dependent on the change of the function.
 (6) I did not really understand that a function of xis continuous at x=a if f has a limit as x approaches a and is equal to its function value at x=a and that the function of f(x)=f(a) as the limit of f approaches x
 (11) I wasn't familiarized with the derivative of log_a(x) (which=1/xlna) and the tangent (= sec^2)
 (12) I found the slope but forgot to plug it back in to determine the equation of the tangent line
 (13)I forgot that the derivative of a constant being added or subtracted to x is 0, which gave me the wrong denominator and I should have written the second limit as a quotient by writing it as a positive exponent instead.","For each of the attempts I will make sure to run through the ""cheat"" sheets and rewatch the videos attached to Moodle to make sure I understand each of these checkpoints correctly. I will also double check with the Calc tutors if I have any questions.",No,Sp21 - 001
171,75683,2021-03-31 19:23:00,12,I totally just thought I could add .5x +1 but I really can't and just had a brain fart,making sure I check my work,No,Sp21 - 001
172,57725,2021-04-06 14:05:00,12,I didn't find the equation of the tangent line,I will rewatch videos and take thorough notes of them,No,Sp21 - 001
173,32314,2021-04-12 12:35:00,12,"When deriving from the original function, the derivative of X should be 1. I lost this 1 which made the rest of my work not add up.","Redid the problem in question.
 
 Work should read as this:
 
 f(X)=xy+x+y=3x
 f'(X)=[x(dy/dx)+y(1)] + 1 + (dy/dx) = 3
 Then proceed to solve for DY/DX which, after the work has been done, should be 1/2 and then boom bap you can plug all that into the y-y1=m(x-x1)",No,Sp21 - 001
174,75683,2021-04-21 21:05:00,12,I had an extra y' in my equation.,double check my work,No,Sp21 - 001
175,96431,2021-04-26 11:27:00,12,I missed the dy/dx when differentiating the y term,I will use dy/dx in order to differentiate between the y terms,No,Sp21 - 001
176,62783,2021-04-28 15:43:00,12,"I understood this checkpoint, I just forgot to differentiate the 3x in the equation, I did everything else correctly!",I will review the rules for differentiation of implicit functions and watch review videos to make sure I do it right this time,No,Sp21 - 001
177,58151,2021-04-28 21:03:00,12,I did not apply the product rule when I should have in the first term of the equation.,I will study the different rules like the product rule in order to get this question right.,No,Sp21 - 001
178,31085,2021-04-29 14:19:00,12,"I found the right equation at first but then solved for dy/dx very wrong. I should have gotten dy/dx= 4x-1/1-3y^2. Then for part 2 just plug in (0,1) into that equation.",I met with tutor kind of. Ex. calc tutor. They helped are review the first checkpoint and now I feel like I understand how to do this.,No,Sp21 - 001
179,83943,2021-04-30 11:54:00,12,"Checkpoint 12: Simple mistake forgetting the chain rule.
 Checkpoint 14: Didn't do the critical points of the function or use the derivative correctly. (Need to meet you for this one I am still a little lost)
 Checkpoint 15: I was confused on how to show the inflection points and after going over it with a friend I think I understand better now. 
 Checkpoint 16: I understood the extreme value theorem but I didn't use the derivative correctly to find the critical points. (Like checkpoint 14 I think I need to go over that with you)",I have reviewed how to do the chain rule and looked at past problems that my group worked on. I have also gone to get help from a friend who knows how to do all of this and has really helped me to see what I have done wrong with the checkpoints before to see my mistakes.,Yes,Sp21 - 001
180,62252,2021-05-03 21:18:00,12,"I did not add in dy/dx on the right side, which would be the derivative of the right side.",I will make sure to add dy/dx to both sides of the equation.,No,Sp21 - 001
181,44661,2021-05-04 09:32:00,12,,,,Sp21 - 001
182,31085,2021-05-04 10:46:00,12,I didn't use the chain rule when I should have.,I redid the checkpoint and believe the slope is 1/8. The equation would be the same just with 1/8 being the slope instead.,No,Sp21 - 001
183,18832,2021-05-07 11:30:00,12,"I apparently understood the problem, I just didn't finish it because I didn't plug in the points for point-slope form.","I don't think I really need to prepare again since I understood what I was doing enough to get it mostly right, however, I do think that I need to plug in the points this time.",No,Sp21 - 001
184,77508,2021-04-11 13:40:00,12,I would have to look back at the questions to see what I messed up on,I will re-read the chapters that correlate with these checkpoints and try sample problems,Yes,Sp21 - 001
185,68658,2021-03-25 08:04:00,12,I found the slope insead of the whole equation,Look over finding tangent equation,No,Sp21 - 001
186,57725,2021-03-31 20:34:00,12,I didn't misunderstand it I just didn't submit in time,I feel confident that I have viewed enough videos so that I am confident in doing it,No,Sp21 - 001
187,58151,2021-04-05 13:33:00,12,I did not keep the dy/dx term in the equation for question 2.,I will keep the dy/dx term in the equation and solve for it.,No,Sp21 - 001
188,29436,2021-04-06 18:00:00,12,I accidentally made a simple error when calculating the derivative and dropped the first x on the first step.,Be more focused and triple check my work.,No,Sp21 - 001
189,38687,2021-04-09 12:18:00,12,I had en extra y both times.,Look at notes and videos.,No,Sp21 - 001
190,38687,2021-04-19 08:32:00,12,Incorrect product rule for xy.,Have a meeting with professor Ford.,Yes,Sp21 - 001
191,44661,2021-04-14 10:56:00,12,"(3) I should have remembered that because I was using the limit definition that I needed to write the limit when I analyzed the problem.
 (4) I mixed the idea that temperature is equal to the function of f(q) which means that Temperature will change because it is dependent on the change of the function.
 (6) I did not really understand that a function of xis continuous at x=a if f has a limit as x approaches a and is equal to its function value at x=a and that the function of f(x)=f(a) as the limit of f approaches x
 (11) I wasn't familiarized with the derivative of log_a(x) (which=1/xlna) and the tangent (= sec^2)
 (12) I found the slope but forgot to plug it back in to determine the equation of the tangent line
 (13)I forgot that the derivative of a constant being added or subtracted to x is 0, which gave me the wrong denominator and I should have written the second limit as a quotient by writing it as a positive exponent instead.","For each of the attempts I will make sure to run through the ""cheat"" sheets and rewatch the videos attached to Moodle to make sure I understand each of these checkpoints correctly. I will also double check with the Calc tutors if I have any questions.",No,Sp21 - 001
192,17830,2021-04-06 12:17:00,12,I did everything right I just didn't write down the equation of the tangent line,Write the equation of the tangent line,No,Sp21 - 001
193,96431,2021-05-07 21:12:00,12,"I submitted the wrong file, I emailed the right one to you that I did, if you could accept that, that would be great.",I will submit the right file as I know how to do it.,No,Sp21 - 001
194,44661,2021-05-08 11:25:00,12,I need to stop simplifying my algebra and instead plug in the points into the derived function when solving for dy/dx,"I'll remind myself not to simplify my algebra, because I was doing that in my practice problems in the past",No,Sp21 - 001
195,96431,2021-05-08 12:06:00,12,didnt find the slope with point given,will find slope with point given,No,Sp21 - 001
196,58151,2021-04-05 13:34:00,13,I took too many derivatives and did not stop at the correct time.,"I will check to make sure that the term does not equate to 0/0 or infinity/infinity and when it does, I will stop taking derivatives.",No,Sp21 - 001
197,13358,2021-04-06 20:27:00,13,I did not finish the entire problem as I left 1/infinity as the answer which turns to zero.,Look back at precious attempt and team activities to see what I should do better for the next one.,No,Sp21 - 001
198,29436,2021-04-19 11:02:00,13,I didn't quite understand 0/0 and I tried to do arithmetic with infinity.,Study and review El Hospitals rule,No,Sp21 - 001
199,98539,2021-04-25 21:29:00,13,I didn't simplify the 2nd function correctly. I should have converted it to a quotient.,I will make sure to properly set up the function in the correct simplest way in order to do to correct derivative. I will check for ways to simplify the function into a form where I can easily apply a derivative rule.,No,Sp21 - 001
200,78555,2021-04-26 11:43:00,13,"the scan I uploaded was very bright and made it difficult to read, I also didn't check if the function/limit was an intermediate before using L'Hopitals rule.",use a darker pen this time :) and review L'Hopitals rule.,No,Sp21 - 001
201,58151,2021-04-27 13:31:00,13,I did not fully understand the rule and did not use it correctly.,I have looked at the book and done some practice to prepare for this reattempt.,No,Sp21 - 001
202,31085,2021-04-29 14:37:00,13,"I understand how to do the first one, I just made a mistake in my multiplication. For the second one I did not know to move it to the denominator. Then after that it was easy.",Met with Ex. tutor who walked me through it and explained it to me. I feel confident about this check point now.,No,Sp21 - 001
203,46516,2021-05-02 12:32:00,13,I took the derivative of the ln(4w^2) wrong and it messed up my final value,I have already looked at the indeterminate form and l'hopital's rule again because I didn't remember perfectly. I will also try some more ln derivative practice problems because that is what messed me up.,No,Sp21 - 001
204,62783,2021-05-02 16:54:00,13,"I accidentally used l'hopital's rule when it only works for division, and I mistook a square for a cube in the function's denominator. Other than this, I had a good understanding of what the question was asking me","I want to take a deeper look at l'hopital's rule to gain more confidence and understanding in how to use it, and I know there are some extra problems with it that I can do as well",No,Sp21 - 001
205,31085,2021-05-06 08:43:00,13,"First, the ln(x) really through me for a loop in both problems. Then in the second one I did't make a denominator.",I am going to meet with a tutor today and with Dr. Ford too.,No,Sp21 - 001
206,31085,2021-05-06 14:06:00,13,I didn't know how to do the ln(x) and move it to the denominator.,I met with the tutor again.,No,Sp21 - 001
207,18832,2021-05-07 11:32:00,13,"I didn't rewrite the second part as a quotient, so it should've been 1/2ze^z.",I'll just be more careful when I'm writing out the final answer. I need to look more carefully at the small details and pay more attention to them.,No,Sp21 - 001
208,38687,2021-04-09 12:20:00,13,I missed on the quotient for L' Hospitals rule.,"Look at videos, do some of the extra problems for the L' Hospitals rules you posted, and look at some videos.",No,Sp21 - 001
209,38687,2021-04-19 08:33:00,13,I had incorrect derivatives in part 1.,Have a meeting with professor Ford.,Yes,Sp21 - 001
210,44661,2021-04-14 10:56:00,13,"(3) I should have remembered that because I was using the limit definition that I needed to write the limit when I analyzed the problem.
 (4) I mixed the idea that temperature is equal to the function of f(q) which means that Temperature will change because it is dependent on the change of the function.
 (6) I did not really understand that a function of xis continuous at x=a if f has a limit as x approaches a and is equal to its function value at x=a and that the function of f(x)=f(a) as the limit of f approaches x
 (11) I wasn't familiarized with the derivative of log_a(x) (which=1/xlna) and the tangent (= sec^2)
 (12) I found the slope but forgot to plug it back in to determine the equation of the tangent line
 (13)I forgot that the derivative of a constant being added or subtracted to x is 0, which gave me the wrong denominator and I should have written the second limit as a quotient by writing it as a positive exponent instead.","For each of the attempts I will make sure to run through the ""cheat"" sheets and rewatch the videos attached to Moodle to make sure I understand each of these checkpoints correctly. I will also double check with the Calc tutors if I have any questions.",No,Sp21 - 001
211,18832,2021-05-08 12:46:00,13,"I appear to have done the work correctly, but I neglected to take the limit after I applied the rule, which was the entire point of applying the rule in the first place.",I'm going to make sure that I've answered all questions before I submit the checkpoint and make sure that I fulfilled the requirements of what the checkpoint was asking.,No,Sp21 - 001
212,47088,2021-04-05 08:01:00,14,I misunderstood the entire thing. I thought I knew before I started my attempt,I reread and watched some khan academy.,No,Sp21 - 001
213,57725,2021-04-09 08:07:00,14,I need to find out how to find critical points other than looking at the graph and find out the increasing and decreasing intervals.,I will book an office hours with Dr. Ford,Yes,Sp21 - 001
214,57725,2021-04-10 11:29:00,14,I found the critical points by using desmos not by calculating it and I didn't specify decreasing and increasing intervals,I had an office hour with Dr Ford,No,Sp21 - 001
215,16144,2021-04-13 16:05:00,14,I simplified my critical points and didn't write out the exact intervals which the function increased or decreased at.,I'm going to find the critical points in some problems.,No,Sp21 - 001
216,29436,2021-04-19 11:01:00,14,"I didn't quite understand the 0/0 part, and I tried to do arithmetic with infinity.",Study and review El Hostpital rule,No,Sp21 - 001
217,29436,2021-04-19 11:03:00,14,I didn't provide the calculations for the first derivative test I just did it on my calculator,Provide the calculations this time,No,Sp21 - 001
218,16144,2021-04-26 09:35:00,14,"When I was writing my intervals, I split the increasing and decreasing intervals into multiple sections instead of just writing three intervals","Now I understand that I should just write where the intervals are increasing and decreasing, and I won't just write the intervals based on my test points.",No,Sp21 - 001
219,96431,2021-04-26 11:28:00,14,I did not use the quadratic formula,I will use the quadratic formula to solve for the values,No,Sp21 - 001
220,78555,2021-04-26 11:49:00,14,didn't show my work to find the critical values used or properly show how it was increasing or decreasing.,"show my work this time, review the necessary material in the book and on Moodle",No,Sp21 - 001
221,18832,2021-04-27 20:16:00,14,"It seems that my misunderstanding of this particular checkpoint was identifying the specific intervals where the function was increasing or decreasing. I might need help understanding if I'm supposed to use a different format that a number line, like if I should do negative infinity to -.197 is positive, and -1.96 to 2.53 is negative, and so on.","I will review my notes and visit an office hour to clear up what I misunderstood from this particular checkpoint and how I can change what I did to do it the way I was asked to. Office hour has already been booked, so I didn't book it through here.",No,Sp21 - 001
222,32314,2021-04-29 13:24:00,14,"10: Did not apply product rule to the numerator of function. 
 14: Was not able to fully explain how to use derivative test to prove maxes and mins",Worked through both of the problems again and went to Tutors and talked to Dr. Ford to get explanation and double check that my rework made sense.,No,Sp21 - 001
223,31085,2021-04-29 14:57:00,14,I did not know at all how to solve for the critical points. I knew I was supposed to set it to 0 but nothing other than that. That meant I could not do the rest of the problems and was just guessing.,I met with ex. tutor and they showed me how to solve for x. And helped me with the second derivative test. I could do the first one without guidance.,No,Sp21 - 001
224,83943,2021-04-30 11:54:00,14,,,,Sp21 - 001
225,44661,2021-05-04 09:32:00,14,,,,Sp21 - 001
226,18832,2021-05-07 11:45:00,14,"I found all critical and inflection points, but I didn't actually perform the first or second derivative test in order to find the min or max, I actually just found the inflection points, which is when you find the zeroes of the second derivative, and I think the second derivative test is when you actually just plug in numbers into the second derivative and put them in a table and see where the graph is increasing and decreasing.",I'm going to go back quickly and look at the second derivative test and make sure that I understand it correctly now.,No,Sp21 - 001
227,77508,2021-04-11 14:50:00,14,"On checkpoint 10 I messed up the basic derivative in the denominator, should be fine otherwise, in checkpoint 12 I screwed up simplification and the product rule, and in checkpoint 14 I messed up with switching signs and simplification/algebra, I think I need a bit more understanding of critical values.",I will look at your videos posted to moodle and try some practice problems. This is different because I typically only read the book to refresh my memory from my previous experience of calc in high school.,Yes,Sp21 - 001
228,68658,2021-04-04 21:43:00,14,Im not sure if i turned it in correctly,I will reread the chapter and look over past activities,No,Sp21 - 001
229,68658,2021-04-09 08:08:00,14,How to make the equation a quotient,watched videos and the lecture helped,No,Sp21 - 001
230,38687,2021-04-09 12:22:00,14,for some reason I'm very confused with this.,"Talk to professor Ford, and ask for examples, and look at notes as well as videos.",Yes,Sp21 - 001
231,58151,2021-04-12 23:25:00,14,"I was not clear enough with my labels including what test I used, and where it is increasing and decreasing.",I will be sure to label everything and make sure that I show all of the necessary steps in my work.,No,Sp21 - 001
232,96431,2021-05-07 21:13:00,14,I didnt test where the points are positive and negative,I will check my work,No,Sp21 - 001
233,44661,2021-05-08 01:15:00,14,"14: Made an algebraic mistake by trying to take out a 6 instead of doing a quadratic formula immediately
 19: I didn't correctly find the area of the first part because I left out everything under the x-axis and in the second part I did not calculate the heights which I should have done by evaluating each endpoint with the function.",I will run through practice problems and watch some teaching/ walkthrough videos,No,Sp21 - 001
234,96431,2021-05-08 12:07:00,14,I didnt explain which test I used,I will explain which test I used,No,Sp21 - 001
235,18832,2021-05-08 12:47:00,14,"What I did incorrectly was that I used the inflection points to describe where the graph was increasing and decreasing, but I didn't show my work for them, and I was actually supposed to just use the critical values for that.",I'm going to use the critical values next time and then graph the function to make sure that my answers are correct. I will show all work next time too.,No,Sp21 - 001
236,19343,2021-04-13 09:52:00,15,understood the problem but made mistakes on taking a 2nd derivative,I have looked over the rules for the chain rule again and more specifically taking the der of the (e^x),No,Sp21 - 001
237,13358,2021-04-14 19:41:00,15,I miscalculated the second derivative by making an algebraic mistake.,I'll reattempt the same checkpoint until I get it right and then look back at the team activities for the problems.,No,Sp21 - 001
238,29436,2021-04-19 11:07:00,15,I was confused on a part of the problem and I knew it wasn't right so I didn't submit anything. I know what I did wrong and what to do now I just messed up the CN,Review the material. It will be different because I know what I did wrong.,No,Sp21 - 001
239,17830,2021-04-22 19:28:00,15,I incorrectly calculated e^0. I also didn't need to find the critical points in order to find inflection points,I will look through the book and familiarize myself with the material,No,Sp21 - 001
240,14772,2021-04-24 16:12:00,15,I used brackets instead of parentheses on a range that included infinity.,I will look again at rules surrounding use of brackets and parentheses.,No,Sp21 - 001
241,98539,2021-04-25 21:39:00,15,I forgot to include the concavity of of f'' when f''=0,I will remember to check both derivatives.,No,Sp21 - 001
242,78555,2021-04-26 11:59:00,15,made a calculation error in the first derivative,"review last attempt, feel pretty comfortable with this section.",No,Sp21 - 001
243,18832,2021-04-27 20:18:00,15,"My misunderstanding of this particular checkpoint was that I calculated the first derivative in order to find the concavity, and I was supposed to use the second derivative, so that threw it off a bit.",I will review concavity and first and second derivates in order to understand their relationship before I do the checkpoint again.,No,Sp21 - 001
244,58151,2021-04-28 21:06:00,15,I am not using the product rule correctly.,I will go back and study the different rules like the product rule.,No,Sp21 - 001
245,31085,2021-04-29 15:31:00,15,I only went to the first derivative and then solved when I should have gone to the second derivative and solved there.,I met with ex. tutor they showed me where I messed up but otherwise I know how to do it.,No,Sp21 - 001
246,83943,2021-04-30 11:54:00,15,,,,Sp21 - 001
247,78555,2021-04-30 19:35:00,15,I accidentally took the first derivative wrong,"review previous attempt, study necessary materials on Moodle and in textbook",No,Sp21 - 001
248,46516,2021-05-05 15:18:00,15,When trying to find the inflection point using the second derivative test I set the second derivative = 0 but I didn't solve it right. I thought that 0 was the value that made f''(x)=0,"Like the others I have reviewed the text to make sure that I understand the derivative tests, as well as doing some practice problems on khan academy",No,Sp21 - 001
249,96431,2021-05-05 17:45:00,15,I did not do the second derivative,I will do the second derivative,Yes,Sp21 - 001
250,62783,2021-05-05 18:59:00,15,"in these problems, I didn't show well enough how I found the points that I did (I used desmos), and I thought that I had found the second derivative, but I was wrong","I'm going to have a friend who is also in this class help me review, and I'm also going to watch videos and go over assignments from this unit to help!",No,Sp21 - 001
251,18832,2021-05-07 11:50:00,15,"So, I found the inflection points and I understood where they were concave up or down, but I neglected to list like if those specific points where concave up or down, I just drew a graph.","I need to read questions more carefully and answer them to their fullest extent. Considering that I keep making the same mistakes, I need to take more time to closely review my answers and make sure I respond to all of the questions before I submit my answers.",No,Sp21 - 001
252,68658,2021-04-08 18:36:00,15,How to find the inflection point and the label the intervals,Reread the section and watch a few videos,No,Sp21 - 001
253,38687,2021-04-19 08:35:00,15,my derivatives were wrong.,Book a meeting with Professor Ford.,Yes,Sp21 - 001
254,38687,2021-04-19 08:36:00,15,my derivatives were wrong.,Book a meeting with Professor Ford.,Yes,Sp21 - 001
255,96431,2021-05-07 21:15:00,15,i didn't solve for the second derivative to be 0,I will solve for 0,No,Sp21 - 001
