,ID,timestamp,checkpoint,mistakes,preparation,office_hours,semester
353,18832,2021-05-08 12:53:00,24,"I didn't find the antiderivatives and so I also didn't find the definite integral, so the questions weren't truly answered because I need a definite integral in order to be able to find the net change and the average value.",I'm going to review section 4.4 because clearly the way to go about this problem just flew over my head for this checkpoint. I will also watch a YouTube video on how to solve these problems so that I'm sure I'm doing it right.,No,Sp21 - 001
354,31085,2021-05-08 17:04:00,24,I did not correctly label the average value.,I looked to see how to find the average value and now think I am ready.,No,Sp21 - 001
355,32314,2021-05-03 15:39:00,12,"12: Mixed up how I was differentiating/did not use the correct rule when differentiating out.
 13: incorrectly differentiated/moved from (1/t)(2t) into 1/2t^2, where I'd be done. Also did not realize Hopital rule can only be used in quotient
 15: Incorrectly said there were bounds on limit, but there are none so should've just had it go on forever.
 20: Did not explicitly state geometric meaning and bounds within definition.",,,Sp21 - 001
356,32314,2021-05-03 15:39:00,13,"12: Mixed up how I was differentiating/did not use the correct rule when differentiating out.
 13: incorrectly differentiated/moved from (1/t)(2t) into 1/2t^2, where I'd be done. Also did not realize Hopital rule can only be used in quotient
 15: Incorrectly said there were bounds on limit, but there are none so should've just had it go on forever.
 20: Did not explicitly state geometric meaning and bounds within definition.",,,Sp21 - 001
357,32314,2021-05-03 15:39:00,15,"12: Mixed up how I was differentiating/did not use the correct rule when differentiating out.
 13: incorrectly differentiated/moved from (1/t)(2t) into 1/2t^2, where I'd be done. Also did not realize Hopital rule can only be used in quotient
 15: Incorrectly said there were bounds on limit, but there are none so should've just had it go on forever.
 20: Did not explicitly state geometric meaning and bounds within definition.",,,Sp21 - 001
358,32314,2021-05-03 15:39:00,20,"12: Mixed up how I was differentiating/did not use the correct rule when differentiating out.
 13: incorrectly differentiated/moved from (1/t)(2t) into 1/2t^2, where I'd be done. Also did not realize Hopital rule can only be used in quotient
 15: Incorrectly said there were bounds on limit, but there are none so should've just had it go on forever.
 20: Did not explicitly state geometric meaning and bounds within definition.",,,Sp21 - 001
359,77508,2021-04-21 11:43:00,14,On checkpoint 12 I messed up the implicit differentiation and isolating dy/dx. On checkpoint 14 I misused my critical points in my derivative tests. On checkpoint 16 I used a number that was outside of the interval.,I will look over my old submissions and read the chapters from those sections. This will be different from my preparation before because I am going to specifically tailor my reading towards the checkpoints and what I have missed.,Yes,Sp21 - 002
360,77508,2021-04-21 11:43:00,16,On checkpoint 12 I messed up the implicit differentiation and isolating dy/dx. On checkpoint 14 I misused my critical points in my derivative tests. On checkpoint 16 I used a number that was outside of the interval.,I will look over my old submissions and read the chapters from those sections. This will be different from my preparation before because I am going to specifically tailor my reading towards the checkpoints and what I have missed.,Yes,Sp21 - 002
361,14772,2021-04-17 17:20:00,15,Checkpoint 16 I messed up my factoring out. Checkpoint 17 I did not show how my maximum was a maximum,I will prepare by looking over those checkpoints and seeing if I can fix my mistakes as well as doing a couple other practice problems to make sure I can do the problems correctly. This preparation will be different because I did not do additional practice problems before my first attempt.,No,Sp21 - 002
362,14772,2021-04-17 17:20:00,16,Checkpoint 16 I messed up my factoring out. Checkpoint 17 I did not show how my maximum was a maximum,I will prepare by looking over those checkpoints and seeing if I can fix my mistakes as well as doing a couple other practice problems to make sure I can do the problems correctly. This preparation will be different because I did not do additional practice problems before my first attempt.,No,Sp21 - 002
363,37786,2021-04-19 10:43:00,1,Arithmetic error,Pay more attention to my arithmetic.,No,Sp21 - 002
364,44913,2021-04-26 13:26:00,1,I didn't understand rate of change properly.,Practice some rate of change problems,No,Sp21 - 002
365,77328,2021-04-19 14:52:00,1,"My work was correct, however my graph did not show a rate of change of 3 from (0 to1).",Reviewing the content that discusses and explains how to create a function (via graph or formula) that shows a specific rate of change over an interval is not true.,No,Sp21 - 002
366,74608,2021-02-28 19:16:00,1,I dint understand the rat of change at the time enough.,I am going to review it more and hopefully become more comfortable.,No,Sp21 - 002
367,37786,2021-04-19 10:44:00,2,"I mistakenly wrote that the limit did not exist when it should have, but then I said it existed later so I need to be more cohesive in my answer. I also needed to use values in approximation that were closer to 2, instead of using 1 and 3, which don't tell much. Using numbers like 2.0001 and 1.9999 would have worked better.","I am going to rewatch videos on the subject, and look through my notes to see what I did wrong. Then I will relook at the problem in the checkpoint and pinpoint my mistakes.",No,Sp21 - 002
368,74608,2021-02-28 19:20:00,3,"I needed to write the limit at each step, instead of putting just g'(4)= I needed to put the limit = at each step",I will rework with writing the limit each time and complete all the steps necessary so it is a clear answer,No,Sp21 - 002
369,65004,2021-03-01 11:10:00,3,I didn't write limit on each step,Write limit on each step,No,Sp21 - 002
370,15531,2021-03-03 17:52:00,3,"In high school, my math teachers never bothered me about keeping my limits on every single step, so I'm glad you called me out on it, because I'm sure I wouldn't kept doing that over and over again. Other than me missing my limit statements at the beginning of each function, there shouldn't be an issue with what I wrote.","I'm going to rerun through the problem I had on checkpoint 3, and make sure I remember to include my limit statement at the beginning of each step.",No,Sp21 - 002
371,65004,2021-03-04 10:17:00,3,I forgot to add the limit signs to my equations. Without the limit signs there is no way to know what value h is approaching and therefore they shouldn't be able to cancel out.,I have read through my notes and looked at the proper way to write the limit definition of a derivative.,No,Sp21 - 002
372,65004,2021-03-08 17:51:00,3,"I messed up on the algebra for Checkpoint 3. Specifically, I needed to take the derivative of of g(x) by using the limit definition.",I will re-watch the videos of the limit definition and how to apply it. This will be different from before as I have been relying heavily on the textbook for guidance.,No,Sp21 - 002
373,66810,2021-03-14 20:42:00,3,"When using the limit def to find a derivative, I didn't write the limit at each step and I also did not carry a negative sign throughout my calculations, which gave me an extra term.",Make sure I am conscious about writing the limit at each mathematical step and correcting my algebraic step.,No,Sp21 - 002
374,74608,2021-03-17 18:46:00,4,"My writing was too messy and unorganized in part 1, I also failed to calculate the instantaneous velocity at the certain point which was given.",I have worked more with the instantaneous velocity problems and understanding how to compute those in a clear form. This preparation will be different because I know what errors I have made and how to correct those,No,Sp21 - 002
375,58850,2021-03-23 13:53:00,4,Instead of finding the velocity I found the highest point,I have re read the notes you made on my submission and I understand what it is that I did wrong and it was a small minor mistake.,No,Sp21 - 002
376,37786,2021-04-19 10:46:00,4,i didnt fully understand how to do the problem between the interval given.,"I am going to do review my mistake, read through the book, and practice a bit more.",No,Sp21 - 002
377,58850,2021-04-19 15:42:00,4,i am mis interpreting the units given to me.,"I think I know how to fix my issue. I will re watch videos and try again, it’s a simple error that i can fix",No,Sp21 - 002
378,77508,2021-04-21 11:43:00,12,On checkpoint 12 I messed up the implicit differentiation and isolating dy/dx. On checkpoint 14 I misused my critical points in my derivative tests. On checkpoint 16 I used a number that was outside of the interval.,I will look over my old submissions and read the chapters from those sections. This will be different from my preparation before because I am going to specifically tailor my reading towards the checkpoints and what I have missed.,Yes,Sp21 - 002
379,50867,2021-04-26 11:46:00,4,I switched up the units and that messed up the whole thing,I've looked over my nots again and also the gorup work we have done that is similar to the checkpoint and I now understand,No,Sp21 - 002
380,44913,2021-04-26 13:31:00,4,I didn't understand the meaning of derivative in this context,"I am going to try doing some more practice problems other than the webwork and preview, which I don't normally do.",No,Sp21 - 002
381,50867,2021-04-28 11:15:00,4,"What i misunderstood was, the input is in milliliters, the units would be change in temp per milliliter",I will prepare by going over certain units in our class activities and practicing how to know what units should be used and when.,No,Sp21 - 002
382,44913,2021-05-06 12:07:00,4,I misunderstood the units,I will go back past examples and practice those,No,Sp21 - 002
383,44913,2021-05-06 18:19:00,4,I did not understand the units of the derivative,I learned about derivatives and the units of a derivative,No,Sp21 - 002
384,52882,2021-03-05 19:00:00,4,I calculated the average velocity instead of the greatest and I also evaluated the limit wrong,I will review examples from this section,No,Sp21 - 002
385,66810,2021-03-14 20:45:00,4,I misunderstood the instructions,study the related material and review my answers,No,Sp21 - 002
386,52882,2021-03-14 22:31:00,4,I was confused on how temp would change when you give it more than what it says.,practicing and understanding these types of questions,No,Sp21 - 002
387,34064,2021-04-27 10:13:00,4,I misunderstood the way of wording how the dosage calculated and mix up the units and what they meant for that question.,I think I will go over my previous checkpoints related to this content and also go back and watch some of the videos for the preview activities as well.,No,Sp21 - 002
388,65544,2021-04-28 17:11:00,4,I didn't understand how to properly use rate of change.,Review the problem from my first attempt to understand rate of change better.,No,Sp21 - 002
389,65544,2021-05-05 16:32:00,4,I had trouble finding the rate of change and didn't understand how the temp would change if there was more than 50ML,review the first question and review book work,No,Sp21 - 002
390,34064,2021-05-08 15:24:00,4,"So I described what s'(t) represented but the question asked what the physical meaning of the function was, which I was not clear about.",I will make sure to more thoroughly explain what I mean and pay attention to exactly what the question is asking.,No,Sp21 - 002
391,52882,2021-03-05 19:03:00,4,I did not use the points between the values 0 < x < 2,I had an office hour appointment with you and went through this checkpoint so now I understand what I did wrong and how to correct it.,No,Sp21 - 002
392,15531,2021-03-09 19:38:00,5,"I did not correctly infer the behavior of f''(x) from looking at the concavity of the graph of the function, I essentially thought that the graph of f(x) meant the exact opposite of what it actually means for said graph being concave up.","I will go over how to determine the behavior of f""(x) from looking at a graph of f(x).",No,Sp21 - 002
393,65004,2021-03-09 23:57:00,5,I don't really understand how the concave concept works.,I am going to try to look up examples of concave up and down. I may also ask Dr. Ford during his office hour or after class.,No,Sp21 - 002
394,99444,2021-03-10 13:54:00,5,I did not show that the left and the right limits agreed and are equal to the function value.,I will show that said limits agree and are equal to the function value.,No,Sp21 - 002
395,74608,2021-03-17 18:53:00,5,I did not realize that point A had a slope of 0. So that would mean there was no change of concavity. I think my mistake was that I associated the increasing graph after point A as a change in concavity.,"I did some practice problems and asked my group members how they would explain concavity. This time, I got input from other people and I can clearly see my misunderstanding.",No,Sp21 - 002
396,58850,2021-03-23 13:56:00,5,"I misunderstood that even when the points derivative is 0, you can still have it be concave up or down.",I will prepare for the revised attempt by looking over videos on moodle and trying problems on my own to make sure I understand when it should be concave up or down,No,Sp21 - 002
397,52882,2021-04-12 11:40:00,5,"I didn't make it clear enough where it was positive and negative, and how that relates to the concavity at that point.",I will look over to make sure I know how to explain how to find the concavity of a function. I think I knew what I meant but I need to make it more clear when I say increasing and decreasing but also need to make sure I put if it is positive or negative.,No,Sp21 - 002
398,77328,2021-04-19 14:55:00,5,I made an error on the second derivative of A. I said it was 0. It should have been positive because it was concave up.,Re-do the original problem and see where I went wrong. Look up what it means when the first derivative is 0 and how that affects the second derivative.,No,Sp21 - 002
399,60018,2021-04-26 20:05:00,5,"I was confused on the determine the increasing, decreasing, positive, and negative activity of the f' and f''",study up on the first and second derivative and it's behavior,No,Sp21 - 002
400,34064,2021-04-27 10:18:00,5,I think I misunderstood what concavity means and how it relates to the second derivate. I did not apply the concept of concavity properly in checkpoint 5.,"I will go through the textbook and re-read the section on concavity and the 2nd derivative. This time, I will do some extra problems and see how that compares to my checkpoint 5 attempt.",No,Sp21 - 002
401,65544,2021-04-28 17:18:00,6,"when I answered the question I talked about the requirements for differentiability not for continuity, I need to talk about the requirements for continuity not differentiability",I will answer the question by stating the requirements for continuity not the requirements for differentiability.,No,Sp21 - 002
402,37786,2021-04-29 09:55:00,6,I messed up the definition of a continuous and differentiable function,i will review the definition of the continuous and differentiable functins.,No,Sp21 - 002
403,44913,2021-05-06 11:33:00,6,I did not state the correct rules for function to be continuous. because of my incorrect definition for continuous graphs it affected the rest of my answers.,to help myself I will re watch the videos on continuity and differentiability. I believe that if I can understand the correct definition I will be able to complete the problem.,No,Sp21 - 002
404,34064,2021-05-08 15:27:00,6,I used the incorrect definition of a continuous function,I will use the definition from the book (1.7.6),No,Sp21 - 002
405,65004,2021-03-10 00:00:00,6,I mixed up what is differentiable and what is continuous. I looked at them in opposite manners.,I will prepare for this attempt by looking over 1.7.6 and other areas of the work we have completed in class. It is different from what I've done before because I look at continuous and differentiable in the right light now.,No,Sp21 - 002
406,66810,2021-03-21 18:37:00,6,I don't quite understand what I did wrong in part 2,I will make an appointment to go over it during office hours,Yes,Sp21 - 002
407,77328,2021-04-19 14:58:00,6,I got it wrong a while ago and it got taken down from Moodle but I am pretty confident I can solve it correctly this time,I will solve it correctly and look at the topic it covers and study that topic before I attempt it again.,No,Sp21 - 002
408,50867,2021-04-26 11:48:00,6,"I messed up on the continuity of the graph, and my graph should have been continuous, and it was not continuous but it had a point where it was not differentiable. My question 2 was not correct because it did not accurately display continuity.","I will rewatch the videos available on continuity, and reread the textbook, as well as look at my past notes on the subject. Then I will rewrite the problem I had in checkpoint 6 to see if I truly understand it.",No,Sp21 - 002
409,65544,2021-04-28 17:26:00,6,I forgot to write the limits statement for part 2. I need to have the limit statement as x->1 from the left and the right,I review the team activities from the section to make sure I understand the notation for piece-wise functions.,No,Sp21 - 002
410,37786,2021-04-29 10:07:00,6,I graphed the functions and thought that there was no limit at x=1. I did not properly use the functions on their respective sides of the graph.,I will look at practice problems and watch the videos posted on Moodle that correspond to continuity. This will be different since the majority of practice I had on this topic came from the in-class group work.,No,Sp21 - 002
411,22902,2021-05-05 23:31:00,6,"I misunderstood how to graph the function. I made it continuous but differentiable, when it should have just been continuous.",I will look over moodle videos and problems to make sure I know the difference between when a function is continuous or continuous and differentiable.,No,Sp21 - 002
412,44913,2021-05-06 11:34:00,6,"I didn't show enough info to prove the function was continuous, and my graph wasn't continuous either.",I studied what continuous functions were more and did extra practice.,No,Sp21 - 002
413,96596,2021-03-10 10:51:00,6,I missed the check point,be prepared to take the checkpoint and actually attempt this time,No,Sp21 - 002
414,65004,2021-03-16 22:37:00,6,I did not compare both sides of the function individually. I wrote that the function is not defined at x = -2 but it is on one of the sides of the function.,Apply the correction the the original problem. Practice comparing both sides of the function.,No,Sp21 - 002
415,65544,2021-04-28 17:34:00,6,"I did not define the limits that I used in #2 and I did not show that the functions value and limit at x=1 were the same. From what I understand, I got the math and questions right but I left out some important details.l",I will make sure to define the limits and show how I got to the conclusions.,No,Sp21 - 002
416,44913,2021-05-06 11:40:00,6,I misunderstood how to properly graph the function. I made the graph continuous but it shouldn't be differentiable.,I will prepare by looking through the videos and active calculus problems to understand how to graph the function properly.,No,Sp21 - 002
417,66810,2021-03-27 19:56:00,7,I think when I saw the x^2 I was a bit confused on what to do. I believe that I used the incorrect equation for the tangent line,"I actually have asked some of my group members who have passed how they posed and im trying to compare the answers to see where I went wrong. I am also going to re watch the video notes, and go over my notes again.",No,Sp21 - 002
418,50542,2021-03-29 18:42:00,7,I did not understand the difference between the equation of the tangent line and the derivative,I will reread over section 1.9,No,Sp21 - 002
419,77328,2021-04-26 14:51:00,7,"Most of my error was in part 3. I don't need to take the derivative in part 3, which I did originally. I didn't use the slope of the tangent line to find what the graph should have been, and I should've used the slope to make a formula for the function. I also needed to put the equation into y-y1 = m(x-x1) form, instead of y = mx + b form.","I'll reread the textbook, and if I'm struggling, watch the videos. Then I'll resolve part 3 with a better understanding, and make sure to remember more about checkpoint 7 when I take it again, mostly by re-reviewing, since it has been a while since I did work that was present in checkpoint 7.",No,Sp21 - 002
420,65544,2021-04-28 17:47:00,7,I didn't understand the point slope formula step,I will look back at my work in that section,No,Sp21 - 002
421,37786,2021-04-29 10:08:00,7,Did not attempt on time,I will look over equations of tangents lines to a function at a point and make sure I know how estimate the values of the function. I will look through moodle videos and work equations so I understand tangent lines better.,No,Sp21 - 002
422,69434,2021-03-28 16:18:00,7,Ummmm there's no feedback and I can't see what I turned in so I do not know what I did wrong here.,I watched the lectures again and have become much more familiar with derivatives and their respective tangent lines.,No,Sp21 - 002
423,50867,2021-03-29 10:08:00,7,"I did everything right, but in the equation I put the wrong number for slope even though I had calculated the slope",I was already prepared. I will make sure to look it over so I don't make a stupid mistake.,No,Sp21 - 002
424,50542,2021-03-29 18:43:00,7,I also missed this one,Review the work for this checkpoint,No,Sp21 - 002
425,58850,2021-04-19 15:43:00,7,I think I just struggled with the instructions on both of the checkpoints,read through the instructions more thoroughly and take my time. I will also refresh the materials.,No,Sp21 - 002
426,60018,2021-04-26 20:08:00,7,I did not know how to do #2 where it asked me to describe a function where the equation of the function and the equation of the tangent line are the same.,"If a graph had the same slope throughout, the tangent line would also have to stay the same. So, to do #2 I would have to make a graph where the slope of the line was constant so the tangent line would be the same as well.",No,Sp21 - 002
427,65544,2021-05-03 12:22:00,7,when finding the equation for the tangent line at x=2 instead of entering the slope at that point which was 4 i entered the equation for the derivative of the function which was 2x,"Given the nature of the mistake, I will be more careful and double check that I am entering the slope for the tangent line rather than the equation for the derivative, this way i can cant minor error and track my work better which i did not do on the first attempt.",No,Sp21 - 002
428,65544,2021-05-05 16:34:00,7,I mistakenly thought that because a function was its own derivative it would be equal to its own tangent line.,I will be meeting with Dr. Ford so that I can better understand what I got wrong.,No,Sp21 - 002
429,65004,2021-03-29 12:15:00,8,My scan did not scan #2 and I did not realize that.,I will re-scan my checkpoint 8,No,Sp21 - 002
430,50542,2021-04-06 18:03:00,8,I havn't gotten it back yet but I know I wrote the wrong derivative for cos(x) its - sin(x) and I just put sin (x),"I've already looked back at my notes, I know what i'm doing",No,Sp21 - 002
431,58850,2021-04-19 15:45:00,8,Did not attempt on time,"I will look over moodle videos and work equations to make sure I understand how to compute derivatives correctly. Also, make sure I know how to compute derivatives with any power, polynomial, sine or cosine, etc.",No,Sp21 - 002
432,77328,2021-04-26 14:55:00,8,I got confused with signs on my attempt,do practices problems like the question I got wrong and double check signs,No,Sp21 - 002
433,98626,2021-04-26 19:45:00,8,I think I just struggled with the instructions on both of the checkpoints,read through the instructions more thoroughly and take my time. I will also refresh the materials.,No,Sp21 - 002
434,80334,2021-04-29 09:37:00,8,I had the sign for sin and cos mixed up.,Ill look into more problems that have to do with cos and sin so I understand how the signs change.,No,Sp21 - 002
435,80334,2021-05-03 15:06:00,9,I misunderstood the use of brackets,I will reread the section for this checkpoint,No,Sp21 - 002
436,77328,2021-05-03 16:28:00,9,I used the product rule when I should have used the chain rule,I will review the chain rule and do some more practice and I still feel like I am not understanding when to use the chain rule I will meet with Dr. Ford,Yes,Sp21 - 002
437,96596,2021-03-28 13:35:00,9,"My mistake was that in using the chain rule, I used addition between both parts of chain rule rather than multiplying them together, so for example instead of -sin(x^2) * 2x, it was -sin(x^2) + 2x","I'm going to relook at chain rule in the book, and make sure I remember confidentially how to take derivatives correctly by watching videos, reading the book, or working through problems.",No,Sp21 - 002
438,50867,2021-04-04 21:15:00,9,In the second question I moved 3 onto the variable when finding the derivative of that problem 3 should not be moved onto the variable.,I will look at moodle videos of how to find derivatives of sin and cosine functions. Also work problems involving finding derivatives with sin and cosine functions.,No,Sp21 - 002
439,50542,2021-04-06 18:04:00,9,I didn't take the derivative of the inside function,Just pay more attention and don't make silly mistakes,No,Sp21 - 002
440,66810,2021-04-11 17:36:00,10,I tried to simplify too much and ended up making a mistake in my simplification.,I'll just remember to keep it simple by knowing that I don't need to completely simplify.,No,Sp21 - 002
